{
  "revision": "0.2",
  "error_codes": [
    "AxisOutOfRange",
    "CountTooLarge",
    "DivisionByZero",
    "DtypeMismatch",
    "EmptyMean",
    "EmptyReduction",
    "IdentityDtype",
    "InsufficientCount",
    "IntegerOverflow",
    "InvalidCast",
    "InvalidDegreesOfFreedom",
    "MacroSyntax",
    "NonFinite",
    "NonIntegral",
    "OutOfRange",
    "Propagated"
  ],
  "excluded_names": [
    {
      "name": "a!",
      "reason": "Superseded alternative frontend; comb! remains the central spelling (ToR C2)."
    },
    {
      "name": "cells",
      "reason": "Superseded rank-application spelling; rank application uses the catalogued operations."
    },
    {
      "name": "cells2",
      "reason": "Superseded rank-application spelling; rank application uses the catalogued operations."
    },
    {
      "name": "id",
      "reason": "Alias of identity; no aliases for pre-1.0 APIs (D06)."
    },
    {
      "name": ".pipe",
      "reason": "A .pipe accepting every descriptor was superseded by the application protocol (context.md §6)."
    },
    {
      "name": "&&",
      "reason": "Array && is rejected; & is elementwise logic (technical design §7)."
    },
    {
      "name": "||",
      "reason": "Array || is rejected; | is elementwise logic (technical design §7)."
    }
  ],
  "contracts": [
    {
      "id": "SC-01",
      "title": "Exact association of reductions and scans",
      "decision": "D07",
      "catalogue_ids": [
        "M006",
        "M007",
        "M008",
        "M009",
        "P009"
      ],
      "preconditions": [
        "The binary operation is total or fallible over the lane dtype.",
        "The lane is rank one after axis selection."
      ],
      "success_relation": "reduce(f)([x1, ..., xn]) = f(x1, f(x2, ... f(xn-1, xn))); fold_left(f)([x1, ..., xn]) = f(... f(f(x1, x2), x3) ..., xn); scan(f) and scan_left(f) return those values for each nonempty prefix, inclusive.",
      "success_conditions": [
        "Inputs are never permuted.",
        "A singleton lane returns its element unchanged without applying f.",
        ".reassociate() permits another grouping only when failure equivalence is proved, an equivalent algorithm is used, or a separately accepted numeric policy applies."
      ],
      "error_relation": [
        {
          "condition": "An application of f fails.",
          "error": "Propagated"
        },
        {
          "condition": "An explicit axis reduction is applied to a rank-zero value.",
          "error": "AxisOutOfRange"
        }
      ],
      "mutation_frame": "Pure: no input, destination, or host state is modified.",
      "termination": "Empty lanes perform no operation. For a nonempty n-element lane, reduce and fold_left apply the binary operation n-1 times, scan_left applies it n-1 times, and exact right-prefix scan applies it n(n-1)/2 times in total.",
      "empty_rule": "Empty reduce and fold_left lanes use only a registered or explicit identity, else EmptyReduction; empty scans return an empty lane without applying f.",
      "examples": [
        "EX21",
        "EX22"
      ],
      "seeded_mutations": [
        {
          "id": "left-reduce",
          "description": "Evaluate reduce with left association."
        }
      ],
      "discharged_by": [
        "PF07.proof@2.2.2"
      ],
      "proof_sketch": "Verus: define spec fn right_fold(f, s) by structural recursion on the sequence; prove lemma_reduce_refines_right_fold(s) for the executable reduce, and lemma_singleton_passthrough(x) without any application of f. Kani: a harness over symbolic 3-element I64 lanes with checked subtraction asserts reduce equals the right fold, with cover!() for both a success and an overflow, and a negative control in which a left fold is rejected."
    },
    {
      "id": "SC-02",
      "title": "Empty-lane identities and explicit identity",
      "decision": "D07",
      "catalogue_ids": [
        "V058",
        "V059",
        "V060",
        "V061",
        "V062",
        "V063",
        "V064",
        "P005"
      ],
      "preconditions": [
        "The aggregate null policy has already been applied.",
        "An explicit identity, when given, has the output dtype."
      ],
      "success_relation": "For a nonempty lane the result is the exact right reduction of the aggregate operation; for an empty lane it is the registered identity (typed zero for sum, one for product, false for any, true for all) or the explicit .identity(value), provided the identity has the output dtype.",
      "success_conditions": [
        "An identity is used for an empty lane only and is never a seed.",
        "Minimum, maximum, and mean have no registered identity."
      ],
      "error_relation": [
        {
          "condition": "Empty minimum or maximum without .identity(value).",
          "error": "EmptyReduction"
        },
        {
          "condition": "Empty mean without .identity(value).",
          "error": "EmptyMean"
        },
        {
          "condition": ".identity(value) whose dtype differs from the output dtype, for any lane length.",
          "error": "IdentityDtype"
        }
      ],
      "mutation_frame": "Pure: no input, destination, or host state is modified.",
      "termination": "A nonempty n-element reduction uses n-1 binary applications; mean then divides once. Empty identities finalize without applying the aggregate operation.",
      "empty_rule": "This contract is the empty rule for the aggregates it lists.",
      "examples": [
        "EX23",
        "EX24",
        "EX25",
        "EX26",
        "EX27",
        "EX28",
        "EX29",
        "EX30",
        "EX31",
        "EX32",
        "EX33",
        "EX72",
        "EX73"
      ],
      "seeded_mutations": [
        {
          "id": "empty-sum-error",
          "description": "Fail an empty sum instead of returning its typed zero."
        },
        {
          "id": "identity-as-seed",
          "description": "Combine the explicit identity with nonempty input as an initial seed."
        }
      ],
      "discharged_by": [
        "PF07.proof@2.2.2",
        "PF07.proof@2.2.3"
      ],
      "proof_sketch": "Verus: prove lemma_identity_only_on_empty(s, id): s.len() > 0 implies aggregate_with_identity(s, id) == aggregate(s), and s.len() == 0 implies it equals id. Kani: harnesses over symbolic lanes of length 0 to 3 assert the registered identities and that an identity never changes a nonempty result, with cover!() for each length."
    },
    {
      "id": "SC-03",
      "title": "Truncating integer division and remainder",
      "decision": "D07",
      "catalogue_ids": [
        "V005",
        "V006"
      ],
      "preconditions": [
        "Both operands are I64."
      ],
      "success_relation": "idiv(a, b) = trunc(a / b) and rem(a, b) = a - b * idiv(a, b), so the remainder takes the dividend's sign.",
      "success_conditions": [
        "The result is within I64."
      ],
      "error_relation": [
        {
          "condition": "b = 0.",
          "error": "DivisionByZero"
        },
        {
          "condition": "a = I64::MIN and b = -1.",
          "error": "IntegerOverflow"
        }
      ],
      "mutation_frame": "Pure: no input, destination, or host state is modified.",
      "termination": "Total: constant work.",
      "empty_rule": "Not applicable: binary scalar operation; null operands propagate null.",
      "examples": [
        "EX34",
        "EX35",
        "EX36",
        "EX37"
      ],
      "seeded_mutations": [
        {
          "id": "floor-idiv",
          "description": "Round the quotient towards negative infinity."
        }
      ],
      "discharged_by": [
        "PF07.proof@2.2.2"
      ],
      "proof_sketch": "Verus: prove lemma_idiv_truncates(a, b) relating the executable checked division to the mathematical truncated quotient, and lemma_rem_sign(a, b): rem(a, b) == 0 or sign(rem(a, b)) == sign(a). Kani: an exhaustive symbolic harness over all I64 pairs asserts both relations and the two failures, with cover!() for each sign quadrant."
    },
    {
      "id": "SC-04",
      "title": "Explicit dtype conversion",
      "decision": "D07",
      "catalogue_ids": [
        "V001",
        "V031"
      ],
      "preconditions": [
        "The target dtype is Bool, I64, or F64."
      ],
      "success_relation": "Bool to I64 or F64 yields 0 or 1; I64 to F64 rounds to nearest, ties to even; F64 to I64 yields the same integer for finite, integral, in-range values; mixed-dtype arithmetic requires an explicit cast.",
      "success_conditions": [
        "-0.0 converts to the I64 zero.",
        "Converting to the same dtype returns the value unchanged."
      ],
      "error_relation": [
        {
          "condition": "F64 to I64 of NaN or an infinity.",
          "error": "NonFinite"
        },
        {
          "condition": "F64 to I64 of a non-integral value.",
          "error": "NonIntegral"
        },
        {
          "condition": "F64 to I64 outside [-2^63, 2^63).",
          "error": "OutOfRange"
        },
        {
          "condition": "Any numeric to Bool.",
          "error": "InvalidCast"
        },
        {
          "condition": "Arithmetic on operands of different dtypes.",
          "error": "DtypeMismatch"
        }
      ],
      "mutation_frame": "Pure: no input, destination, or host state is modified.",
      "termination": "Total: constant work.",
      "empty_rule": "Not applicable: scalar conversion; null converts to null.",
      "examples": [
        "EX38",
        "EX39",
        "EX40",
        "EX41",
        "EX42",
        "EX43",
        "EX44",
        "EX45",
        "EX46",
        "EX47"
      ],
      "seeded_mutations": [
        {
          "id": "implicit-promotion",
          "description": "Widen mixed I64 and F64 operands silently."
        }
      ],
      "discharged_by": [
        "PF07.proof@2.2.2"
      ],